Référence,Type de bien,Location / Colocation,Loyer location €/mois avec charges,Loyer colocation €/mois,Surface totale m²,€/m²,Nb pièces,Nb chambres,Autres,Commune,Détail Localisation,Note localisation,Etiquette NRJ,Etiquette GES,Coût copro /an,Coût charge /chambre (si coloc) /an,Autres coûts /an,Lien,Description entière annonce,Date publication annonce
36,Appartement,Colocation,370,1110,80,"13,875",5,3,"meublé, éuipé, refait à neuf récemment",SAINT-ETIENNE,quartier ROCHETAILLEE,4,C,C,,960,,https://www.leboncoin.fr/colocations/1893297763.htm,"EN EXCLUSIVITÉ - A découvrir, cet appartement meublé de 80m² lumineux et traversant Est / Ouest. Il comprend un séjour salon de 26 m² exposé plein Est ouvert sur une cuisine aménagée de 10m². Séparées du coin jour, vous profiterez de 3 chambres entre 10 et 11 m² et d’une salle de bains avec douche et fenêtre. Dans un secteur calme et prisé de Saint-Étienne : ROCHETAILLEE. Situé à 500m de la Faculté, des écoles et du centre commercial Centre2. Accès direct et facile aux autoroutes par la RN88. À l’entrée, vous arriverez sur un grand espace de vie comprenant une cuisine totalement équipée, ouverte sur le séjour/salon, avec une grande table à manger et un salon aménagé (TV 4K, canapé, internet). Au centre, un dégagement amène sur un couloir desservant : - Les 3 chambres équipées : lit double (140*190) avec literie ressort de qualité, bureau avec prise RJ45, armoire et placards Chaque chambre possède une clef unique pour y accéder : vos affaires personnelles sont donc 100% sécurisées. - Une SDB avec douche Le logement est entièrement meublé et équipé : Machine à laver, écran plat, lit double, canapé, frigo avec distributeur d'eau, lave-vaisselle, four, micro-ondes, vaisselle fournie... Il a été refait à neuf récemment. Vous avez également accès à un parking sécurisé avec badge ainsi qu'à un local à vélo sécurisé. Le loyer par personne est de 290€, auquel il faut ajouter un forfait de 80€ de charges comprenant l'eau, l’électricité, le gaz, le forfait Internet et la taxe d'ordures ménagères. Dépôt de garantie : 290 € Montant des charges : 80 € Pas d'honoraire",11/12/2020
37,Appartement,Colocation,365,1460,120,"12,16666667",5,4,"Refait à neuf en 2018, meublé et équipé à neuf",SAINT-ETIENNE,Quartier beaubrun,3,,,,900,,https://docs.google.com/spreadsheets/d/1FJZICWt9AOL1YUS9f01ZHph7um7uqcpZkqceI6ybQBo/edit#gid=660475171,"Superbe appartement de 120 m² en colocation pour 4 où une chambre se libère le 31/07/2019. L’appartement a été refait entièrement à neuf en 2018. Traversant nord / sud, meublé et équipé à neuf. Situé au 1er étage d'un petit immeuble. Cet appartement dispose des pièces communes suivantes : * 1 grand séjour de 26 m² avec cuisine ouverte équipée. TV, internet haut débit fibre, four, four micro-ondes, lave-vaisselle, lave-linge, sèche-linge et réfrigérateur/congélateur. * 2 salles d'eau * 2 WC * 1 grand placard dans le couloir * 1 balcon coursive au sud. La chambre à une surface de 16 m² et est équipée d'un lit 140*200, 1 table de chevet avec lampe de chevet, un bureau avec lampe de bureau, 1 chaise de bureau, 1 fauteuil, 1 grand dressing. Prises TV et RJ 45 (fibre). Linge de lit fournis. Volets roulants électriques. Prix de la chambre :290 € par mois + Forfait charges de 75 € par chambre comprenant absolument tout. Aucune démarche administrative à faire. Situé dans le quartier Beaubrun, très actif avec tous les commerces au pied de l'immeuble, donnant sur une place dégagée avec arrêt de bus. Gare de Clapier à 5 mn et tramway à 7 mn à pied. Proche hyper centre. La coloc est composée de jeunes actifs, 3 hommes à ce jour. Premier contact par mail ou téléphone au 06 17 93 56 79.",9/12/2020
38,Appartement,Colocation,365,1095,74,"14,7972973",4,3,Vue panoramique dégagée,SAINT-ETIENNE,prox Place Albert Thomas,5,,,,900,,https://www.leboncoin.fr/colocations/1892148583.htm,Saint-Etienne - prox Place Albert Thomas Secteur calme à proximité de toutes commodités - Tram / Grand Rue / Campus Denis Papin à 3 min à pieds - Tréfilerie à 5 minutes à pied - Centre-Ville à 10 minutes à pied - Fauriel à 20 minutes à pied Appartement atypique de 74m² - entièrement meublé Cuisine ouverte sur séjour lumineux de 30m² Une chambre avec vue dégagée disponible (2 chambres déjà occupées) Vue panoramique dégagée - Prestations soignées Loyer : 290 € par chambre Charges : 75 € tout inclus (eau - électricité - chauffage - Internet - copro - entretient chaudière) Au plaisir d'échanger avec vous: 06 74 89 59 87 ou 06 81 29 87 33,9/12/2020
39,Appartement,Colocation,415,2490,211,"11,80094787",7,6,,SAINT-ETIENNE,"Rue Gambetta, secteur Peuple/Chavanelle",5,C,D,,780,,https://www.leboncoin.fr/colocations/1886631988.htm,"Rue Gambetta, secteur Peuple/Chavanelle, 1 place libre dans grande colocation MEUBLEE et EQUIPEE, dans vaste T8 comprenant CUISINE 20 m² ouverte sur séjour 40 m², 6 chambres bien distribuées, 3 SALLES DE BAIN/DOUCHE, BUANDERIE, 3 WC, entièrement EQUIPE, exposé Sud et Ouest, 3ème étage, ascenseur; ensoleillé, équipé FIBRE INTERNET, proche ligne de Tramway (Bellevue-Nord, gare de Châteaucreux), Universités et toutes commodités. La chambre proposée offre une surface de 20 m² et de nombreux rangements. Bon esprit de colocation, les colocataires sont tous de jeunes actifs. Compter environ 65 € pour les charges locatives, le gaz, l'électricité, le téléphone fixe, internet, l'eau, l'entretien de la chaudière, le ramonage et l'enlèvement des ordures ménagères.",8/12/2020
40,Appartement,Colocation,340,1020,72,"14,16666667",4,3,"Equipé de A à Z, tout est fourni, refait à neuf à 2019",SAINT-ETIENNE,"52 RUE DU 11 NOVEMBRE A proximité immédiate du tram, supermarché, banques, tabacs et autres commerces/ Centre commercial...",5,C,B,,480,,https://www.leboncoin.fr/colocations/1891845172.htm,"Bonjour à tous et à toutes !! Merci de bien lire l’annonce ☺ Bien tout confort… Je mets en colocation cet appartement de 72m2 refait complètement A NEUF il y a un an. (3 chambres) Il est composé d'un salon/cuisine, des chambres et d'une salle d’eau à part. Les travaux comprennent l’électricité, plomberie, chauffage, isolation, peintures, sols, décoration, etc… Ce dernier est situé en plein centre-ville de st Etienne au 52 RUE DU 11 NOVEMBRE A proximité immédiate du tram, supermarché, banques, tabacs et autres commerces/ Centre commercial... - Université Jean Monet - Bibliotheque universitaire - SMERRA - Université Tréfilerie - Centre commercial Centre deux - Prépa st Etienne Galien - Ecole supérieure de sécurité Toutes les autres écoles accessibles en tram en quelques minutes. Belles et GRANDES chambres parquet hauteur sous plafond de 3,15M armoire, table de chevai, lits 140x190, bureau, etc… tout est fourni... !! Appartement équipé de A à Z : = Machine à laver le linge, cuisine équipée, machine à café, four/micro-ondes, assiettes, lit, tables et chaises, déco, frigo-congélateur, cuisinière, vaisselle, accessoires de cuisine et couverts, etc. = A votre dispo : TV écran plat, Wi-Fi, literie, draps, serviettes, rangements, etc. Vous n’avez qu’à poser vos valises, vous êtes chez vous !! A très bientôt !!!! Loyer : 300€ + 40€ de charges (elec, eau, pas de gaz)",8/12/2020
41,Appartement,Colocation,350,700,68,"10,29411765",3,2,,VALENCE,"Commerces, transports,école,bus en bas de l'immeuble. L’appartement ce situe à 5 a 10 min minutes du centre ville de Valence,",4,,,,,,https://www.leboncoin.fr/colocations/1895972981.htm,"Femme recherche colocatrice propre,discrète,sérieuse et non fumeuse pour une chambre de 12m² entièrement meublées (lit, bureau, chaise,..) dans un appartement de 70m². Disponible immédiatement Loyer 350e TTC ( chauffage, l'eau, l'électricité, internet ect...) Espace en commun: - Salon tout équipé. - Cuisine équipée (four, micro onde,plaque de cuisson, réfrigérateur , cafetière, bouilloire et vaisselle complète) - Salle d'eau simple vasque et douche, sèche serviette, lave-linge, plusieurs rangement - WC séparé Commerces, transports,école,bus en bas de l'immeuble. L’appartement ce situe à 5 a 10 min minutes du centre ville de Valence, Appartement éligibles au APL.",15/12/2020
42,Appartement,Colocation,300,900,75,12,5,3,Tout équipé,VALENCE,"o Proximité de la cartoucherie
o Accès à toutes les lignes de bus desservant tous les quartiers de la ville 
o Tous les commerces et services (Pharmacie, banques, restaurants, boulangeries, supermarché, coiffeur, médiathèque, etc.)
o Proche de la zone industrielle et commerciale de Bourg Les Valence",3,C,C,,,,https://www.leboncoin.fr/colocations/1895960823.htm,"Chambre disponible immédiatement 300€ + 60€ de charges Bonjour, Je vous propose une chambre meublée dans un appartement de 75m2 agréable à vivre, tout équipé et meublé pour une colocation de qualité. Idéal pour un séjour de longue durée. Ambiance partage, tranquillité, vie de jeunes actifs L’appartement se compose de 3 chambres, lumineux et traversant Est Ouest donnant une superbe vue imprenable sur Crussol depuis le balcon. Il est situé au 49 avenue de Lyon, Bourg les Valence, dans une résidence sécurisée au 4ème étage sans ascenseur, idéalement placé à deux pas du centre-ville et de toutes les commodités, idéal pour les déplacements en vélo avec un accès spécifique pour garage à vélos. Un arrêt de bus est situé au pied de l’immeuble Une rénovation complète a été effectuée en 2019, le mobilier est entièrement neuf et pensé par une décoratrice d’intérieur. Conçu spécialement pour votre confort, cet appartement a été pensé pour garantir le bien-être de ses colocataires. Un climatiseur réversible, Pompe à chaleur, vous offrira un confort supplémentaire notamment l’été UNE FORMULE TOUT INCLUS AU FORFAIT : INTERNET HAUT DEBIT, ELECTRICITE, CHAUFFAGE, EAU FROIDE ET CHAUDE, CHARGES PARTIES COMMUNES Loyers : 360€ tout compris 300€ € + 60 € de charges (pas de régulation) Plus besoin de courir et de perdre du temps précieux, vous avez plus qu’à poser vos valises. Pas de déménagement, d’achat et aucun abonnement à contacter. Pas de frais d’agence. Votre budget est ainsi maitrisé, pas de mauvaise surprise en fin de mois. ++++ A propos de l’appartement ++++ Trois belles chambres meublées de 10 à 11m2, standing et décorée avec gout par une décoratrice d’intérieure, tout confort, grand lit double 140 *200, bureau chaise, télévision, placards de rangement, table de nuit, lampe de chevet, oreiller, couettes et accès internet haut débit fibre wifi. Les chambres sont équipées de fenêtres double vitrage. Grand salon cuisine ouvert moderne climatisé avec un balcon dans la cuisine. Tout équipé de rangements, comprenant un bar, four, plaque de cuisson, frigo congélateur, bouilloire, cafetière, four à micro-onde, télé avec internet / wifi, Vaisselle-ustensile et matériel de cuisine complet, lave-linge, sèche-linge et lave-vaisselle ++++ Localisation et services++++ L’appartement est dans une résidence sécurisée, à deux pas de toutes les commodités et du centre-ville. Sur l’arrière du bâtiment une rue peu passante donnant une vue exceptionnelle sur Crussol du balcon et sur l’avant du bâtiment une jolie vue dégagée sur la ville. o Proximité de la cartoucherie o Accès à toutes les lignes de bus desservant tous les quartiers de la ville o Tous les commerces et services (Pharmacie, banques, restaurants, boulangeries, supermarché, coiffeur, médiathèque, etc.) o Proche de la zone industrielle et commerciale de Bourg Les Valence ++++ la colocation en elle-même ++++ Cout mensuel : Loyers : 300€ tout compris 300 € + 60 € de charges, eau / électricité / internet, ordures ménagères, entretien des parties communes Durée minimum : 1 mois, dans l’idéal 12 mois. Bail individuel, de mobilité Garant : 1 minimum demandé Dépôt de garantie : 405€ Aide au logement : ce logement donne la possibilité de bénéficier des aides au logement de 80€ à 180€ suivant votre situation. Le nombre d’occupants est limité à 3 personnes, un par chambre. Pour plus de renseignements, n’hésitez pas à nous contacter. David",15/12/2020
43,Appartement,Colocation,400,1600,105,"15,23809524",6,4,Tout équipé,VALENCE,"Idéalement placée au 23 rue Mozart à Valence, à deux pas des universités, du centre commercial , d'un arrêt de bus. Accès facile aux autoroutes.",4,D,D,,,,https://www.leboncoin.fr/colocations/1474490526.htm,"Bonjour, colocation 4 chambres dans superbe appartement dans résidence le Parc au 3 eme étage, traversant et très lumineux. 105 m2, entièrement meublé et équipé une chambre Disponible de suite Idéalement placée au 23 rue Mozart à Valence, à deux pas des universités, du centre commercial , d'un arrêt de bus. Accès facile aux autoroutes. Dans l'entrée espace de rangement , dressing. Cuisine équipée, buanderie, salon télé,quatre chambres, balcon , parking gratuit . Dans les chambres , bureau, armoire et lit de 140 avec drap et couette. Logement meublé avec lave linge, lave vaisselle, frigo , four , micro onde , vaisselle fournie.Il n'y a plus qu'à poser les valises. Conviendrait parfaitement à Etudiant , CDI, CDD Loyer : 400 euros charges comprises ( eau, électricité, chauffage,wifi,gaz de ville, ordure ménagère, entretien) une Chambre disponible de suite Pour plus de précisions contacter Eric au 0641972358 A Bientôt !",15/12/2020
44,Maison,Colocation,430,2150,150,"14,33333333",9,5,Tout équipé,VALENCE,Villa en lotissement,2,B,B,,,,https://www.leboncoin.fr/colocations/1895818863.htm,"Loue chambres pour des jeunes professionnels, CDI, CDD, stagiaires. Colocation meublée dans une villa (sans propriétaire) en lotissement résidentiel et calme. 200 m arrêt de bus. 5 chambres, salle à manger/salon, cuisine équipée, 2 douches, 2 w-c, 5 vasques, 3 réfrigérateurs plus congélateur à tiroirs, lave-vaisselle, lave-linge, télévision, canapé, équipement ménager (vaisselle, robots, aspirateur, fer à repasser, etc...), balcon, wifi + internet câblé dans chaque chambres. Entretien des parties communes une fois par mois. Loyer et charges pour une personne : 430 euros tout compris (eau, électricité, chauffage, internet, assurance habitation, taxe d'habitation, entretien mensuel). Point de situation (voir sur la carte). Contrat individuel. Parking réservé + emplacement pour vélos et motos. UNE CHAMBRE DISPONIBLE IMMÉDIATEMENT Contact seulement par téléphone ou SMS : 06 11 24 45 16",15/12/2020
45,Maison,Colocation,350,350,85,"4,117647059",4,1,Tout équipé,VALENCE,,,C,D,,540,,https://www.leboncoin.fr/colocations/1860562627.htm,Chambre meublée en colocation dans une maison moderne climatisée et avec petit jardin. 350€ plus charges fixes de 45€ par mois. Idéal pour une jeune étudiante. Téléphone David sur 0751640996.,14/12/2020
46,Appartement,Colocation,330,330,60,"5,5",3,1,Tout équipé,VALENCE,"Proche de toute commodité, Leclerc à 3 min a pied, Géant Casino à 7 min à pied. L'appartement se situe sur l'avenue Victor Hugo. Arrêt de bus « Grands Moulins » au pied de l'immeuble qui dessert le centre ville.",3,D,E,,,,https://www.leboncoin.fr/colocations/1874354044.htm,"Loue une chambre meublée chez l'habitant avec 1 lit, 1 penderie, 1 bureau et 1 balcon dans un appartement de 60 m². Appartement entièrement non fumeur avec la présence d'un chat. Donc pas d'animaux acceptés. Parties commune : salle de bain, cuisine équipée (four, plaque cuisson, micro-onde etc) et salon. APL possible. Pour collocation sympa dans un cadre calme. Parking au pied de l'immeuble, résidence fermée. Proche de toute commodité, Leclerc à 3 min a pied, Géant Casino à 7 min à pied. L'appartement se situe sur l'avenue Victor Hugo. Arrêt de bus « Grands Moulins » au pied de l'immeuble qui dessert le centre ville. Projet d'un futur potager sur 2 éme balcon en cours. 330 euros charges comprises (eau, électricité, chauffage, internet). Actuellement disponible, premier contact par mail. Caution 300 euros Libre le 29/11/2020. steve2442@hotmail.fr Vous pouvez m'envoyer avant ou après visite : - 1 photocopie de la CNI du locataire et des garants - 1 justificatif de domicile des garants dernière feuille d'imposition des garants ou du locataire - contrat de travail si salarié - 3 dernieres quittance de loyer ou attestation du bailleur - 3 derniers bulletins de salaire des garants ou du locataire Steve",14/12/2020
47,Appartement,Colocation,340,1020,63,"16,19047619",4,3,Tout équipé,VALENCE,10 min centre ville,3,E,F,,720,,https://www.leboncoin.fr/colocations/1887425724.htm,"Bonjour, Je vous propose un appartement de 3 chambres meublées en colocation, entièrement refait à neuf cet été. Il est situé rue des Moulins, à 100m du lycée Camille Vernet. Dans une copropriété calme, avec entrée sécurisée, à 10min à pied du centre ville et de la gare. Deux locataires, de 20 et 25 ans, sont déjà présents. Il reste une chambre de disponible (11m2). Elle est équipée d’un lit-coffre 2 places (avec draps, couettes et oreillers), d’un dressing, d’une table de chevet, d’une chaise et d’un bureau. La cuisine est entièrement équipée : réfrigérateur/congélateur, plaques à induction, four, hotte, lave-linge, micro-ondes, bouilloire, mange-debout, vaisselle et ustensiles de cuisine. Salle de bain : douche à l’italienne, sèche-serviette, meuble-vasque avec rangements, miroir. WC séparé. Un salon cosy avec canapé, fauteuil, table basse, meuble télé, TV, internet avec fibre, étagères, ainsi qu’une porte-fenêtre permettant d’accéder à un long balcon. Divers : étendoir à linge, aspirateur, matériel de nettoyage. Une cave pour entreposer les vélos. Le loyer est de 340 €/mois + 60€ de charges (eau, chauffage/gaz, électricité, internet avec fibre, ordures ménagères, entretien de la chaudière). Bail individuel sans clause de solidarité, permettant l’obtention d’aides au logement. Caution : 1 mois de loyer HC, soit 340 € Garant Téléphone : 06 80 80 70 71",14/12/2020
48,Appartement,Colocation,340,1020,90,"11,33333333",4,3,"Tout équipé, balcon",VALENCE,L'appartement est idéalement situé dans le centre ville.,4,B,C,,720,,https://www.leboncoin.fr/colocations/1894536818.htm,"Bonjour, Chambre à louer dans un spacieux appartement de 3 colocataires (parquet en chêne, cheminées en marbre, balcon, hauts plafonds…). L'appartement est idéalement situé dans le centre ville. Situé dans une copropriété calme et entretenue. - 1 min à pied de la gare SNCF - 3 min à pied du Pôle Bus - 10 min des facultés Camille Vernet, Cinéma... - Moins de 2 min pour commerces et salles de sport Parties communes : -Hall d'entrée de 9m2 -Salon 20m2, aménagé avec canapé, cheminée, placard mural, commode, table ronde… -Cuisine 15m2 équipée : four, gaz, réfrigérateur/congélateur, lave-vaisselle, micro-onde et toute la vaisselle et ustensiles de cuisine nécessaire… -Salle de bain avec machine à laver le linge + WC séparés - Balcon Parties privatives : La chambre est équipée d'un lit 2 place en 140 + bureau + rangements/armoire pour une montant de 340€ A cela s'ajoute 60€ qui correspondent aux charges (Internet, eau, gaz, EDF, entretien chaudière, copro) Local à vélos disponible Chaque bail est individuel sans clause de solidarité. 06 74 48 85 49 06 11 27 10 06",13/12/2020
49,Appartement,Colocation,350,1050,74,"14,18918919",5,3,Tout équipé,VALENCE,"Elle se situe à 15 min à pied ou en bus de la Gare SNCF, 10 min à pied de l’IUT et de l’ESISAR, 7 min en vélo ou 10 min en bus de l’université Grenoble Alpes, 5 min de l’Institut Notre Dame, 5 min de l’IFRSS-FI, 5 min du Centre hospitalier et à 10 min du centre-ville.",4,E,F,,900,,https://www.leboncoin.fr/colocations/1885997753.htm,"Colocation moderne de 3 chambres meublées et rénovées, située quartier Chateauvert, à 2 pas de la cité scolaire Camille Vernet. Entièrement meublée, décorée et équipée, elle vous séduira par son environnement calme et sa luminosité. Elle est située au 4ème et dernier étage de l’immeuble avec une vue dégagée. Dans une copropriété offrant une simplicité d'accès et de stationnement ( local vélos et garage voiture), avec entrée sécurisée, cette colocation est composée d’une pièce de vie meublée avec TV LED UHD et accès à un balcon , d’une cuisine toute équipée (plaque gaz, hotte aspirante, réfrigérateur/congélateur, lave-linge 6kg, lave-vaisselle 12 couverts, four traditionnel chaleur tournante, micro-onde, cafetière, bouilloire, vaisselle, etc...), d’une salle d’eau avec douche à l’italienne avec VMC, de WC séparé, de 3 chambres de 9 à 13 m2 avec un lit de 140*190, un dressing et un bureau dans chaque chambre et d’un espace de rangement commun pour les valises ou autres. Aspirateur, étendoir à linge, fer à repasser et nécessaire de ménage font également parti des équipements. Les commerces de proximités (boulangerie, épicerie, pharmacie, presse, poste, banque coiffeur) ainsi que les transports en commun (Arrêt Citéa Camille Vernet ou Montgolfier) sont à proximité immédiate de l’immeuble. Elle se situe à 15 min à pied ou en bus de la Gare SNCF, 10 min à pied de l’IUT et de l’ESISAR, 7 min en vélo ou 10 min en bus de l’université Grenoble Alpes, 5 min de l’Institut Notre Dame, 5 min de l’IFRSS-FI, 5 min du Centre hospitalier et à 10 min du centre-ville. Tous les profils de colocataires sont recherchés, sachant que l'important est d’avoir ""l'esprit coloc"". Adrien, opérateur en industrie, et Louis, commercial, vous attendent avec impatience. Une chambre est disponible fin décembre. Le loyer de la chambre est de 350€/mois + 75€/mois pour l'ensemble des charges. (Bail individuel sans clause de solidarité). Eligible à l’ALS. Les charges sont vos consommations d'eau, vos consommations d'électricité, vos consommations de chauffage, vos consommations de gaz, l'abonnement internet (fibre optique) avec abonnement Netflix offert, l’entretien de la chaudière gaz, ainsi que toutes les charges d'entretien de l'immeuble. Le dépôt de garantie est de 2 mois HC. Pour garantir l’harmonie entre les colocataires, les couples de sont pas admis. Pas de frais d’agence, ni de commission. Garantie financière demandée (3 fois le prix du loyer avec charge et garant) Garantie Visale acceptée. Premier contact par mail. Photos supplémentaires sur demande.",13/12/2020
50,Appartement,Colocation,390,780,64,"12,1875",3,2,Tout équipé,VALENCE,"Il est situé à 200 mètres du pôle bus, à 10 min à pied de la gare Valence Ville.",3,,,,,,https://www.leboncoin.fr/colocations/1893896629.htm,"Très bel appartement de 63.5m² côté rue. Il est situé à 200 mètres du pôle bus, à 10 min à pied de la gare Valence Ville. Situé au 1er étage sans ascenseur. L’appartement est entièrement meublé. Il comporte deux grandes chambres. Le salon comprend un canapé convertible, une table basse relevable et une télévision. La cuisine est entièrement équipée avec une double plaque vitro céramique, un four, un four à micro-onde, une hotte, un frigo américain avec congélateur, de la vaisselle, des verres, des tasses, des poêles, des casseroles, une bouilloire, une machine à café, un grille-pain, un presse-agrume. La salle de bain comporte une douche, un sèche serviette, une armoire de toilette et un sèche-cheveux. Il y a une machine à laver. Il restera à votre charge (eau, EDF, assurance habitation) à partager entre les colocataires. Le WIFI est compris dans les charges. Photos disponibles sur simple demande. L’appartement est prêt à vous accueillir à partir du 01/02/2021.",12/12/2020
