Référence,Type de bien,Location / Colocation,Loyer location €/mois avec charges,Loyer colocation €/mois,Surface totale m²,€/m²,Nb pièces,Nb chambres,Autres,Commune,Détail Localisation,Note localisation,Etiquette NRJ,Etiquette GES,Coût copro /an,Coût charge /chambre (si coloc) /an,Autres coûts /an,Lien,Description entière annonce,Date publication annonce
1,Appartement,Location,440,440,45,"9,777777778",2,1,,SAINT-ETIENNE,"plein centre de Saint- Etienne ,bas de la rue Michel Rondet, plein centre de Saint- Etienne ,bas de la rue Michel Rondet",5,B,B,,600,,https://www.leboncoin.fr/locations/1889048451.htm,"Idéal étudiant,à louer en plein centre de Saint- Etienne ,bas de la rue Michel Rondet ,appartement 2 pièces comprenant 1 chambre ,1 salon avec cuisine américaine ,1 salle d.eau avec douche ,1 entrée avec grand placard.Chauffage au gaz avec chaudière neuve et doubles vitrage.L’appartement se trouve à proximité de l’ecole d’archi ,palais de justice ,mairie et tous les lieus de vie de Saint-Étienne ,vous accèderez aussi rapidement à pied ou en tramway à la cité du Design les facultés et hôpitaux ainsi qu’à la gare.A noter que l’appartement est situé au dernier étage sans ascenseur(3e),est très clair avec 5 grandes fenêtres. Le loyer est de 390 euros + 50 euros de charges comprenant l’ eau ,l’entretien des parties communes ,l’entretien de la chaudière et la Wifi.",04/12/2020
2,Appartement,Colocation,330,660,40,"16,5",3,2,NEUF et LUMINEUX - idéal étudiants et jeunes travailleurs - 1 salle de bains/douche privative par chambre - parking et internet gratuit,SAINT-ETIENNE,Proche grandes écoles - idéalement situé entre le Cours Fauriel et Centre 2 - espace vert et salle de sports proche - ligne de transports à proximité,4,,,,,,https://www.leboncoin.fr/colocations/1872256326.htm,"T3 MEUBLE - NEUF et LUMINEUX - idéal étudiants et jeunes travailleurs - 1 cuisine ouverte sur pièce commune, entièrement équipée, y compris vaisselle et lave linge - 2 chambres meublées literie confortable + 1 salle de bains/douche privative par chambre - Appartement phonique et thermique - Volets électriques parking et internet gratuit - Logement dans bâtiment privée, de 2 étages, sécurisé par portier - Proche grandes écoles - idéalement situé entre le Cours Fauriel et Centre 2 - espace vert et salle de sports proche - ligne de transports à proximité - visite possible sur rendez vous : Dominique 0616263490",04/12/2020
3,Appartement,Colocation,310,1240,94,"13,19148936",5,4,balcon,SAINT-ETIENNE,Écoles à proximité: ISTP - Institut régional universitaire.. 600m Faculté des sciences techniques à 800m IUT Institut universitaire de technologie à 1.6km ISTP institut de formation d'enseignement supérieur par alternance à 900m Maison des élèves de l'école des mines à 1.2km École des mines à 950m ENISE École nationale d'ingénieur à 900m Ligne de bus M4 à 400m qui dessert une grande partie des écoles et ligne M6 après M4 pour atteindre facilement l'école des mines,4,,,,600,,https://www.leboncoin.fr/colocations/1889110373.htm,"Colocation dans grand T5 de 94m2 à Saint Étienne quartier de la Métare rue Marcel Sembat très calme entre famille et beaucoup d'anciens fonctionnaire des écoles environnantes. Proche du parc de l'Europe.. Idéal étudiant faisant leurs études quartier de la Métare ou personne active avec l'accès à la RN 88 à moins de 2 min. Au 1er étage totalement refait à neuf. Proche de toute commodités Netto, Marie Blachere, pharmacie.. Grand nombre d'école que j'ai répertoriés en fin d'annonce. Très bel immeuble dominant Saint-Étienne qui malgré son 1er étage il dispose d'une très belle vue depuis son balcon. Interphone neuf. 4 chambres . 1 de 13 m2 : occupée 1 de 13m3 : libre 1 de 10m2 :occupée 1de 10m2 : libre Elles disposent chacune de leurs petit dressing, leur bureau, chaise et lampe. 2 salles de bains. 1 toilettes indépendant. 1 grande cuisine toute équipé avec toute la vaisselle (sauf lave vaisselle) qui va avec et les petits équipements. 1 salon avec canapé d'angle et grande TV écran plat 140cm 1 buanderie avec planche et fer à repasser, lave linge et sèche linge tout est neuf. Charges de 50€ comprenant l'eau chaude et froide, électricité, chauffage, internet full option de Bouygue. Bail à l'année avec 1 mois de dépôt de garantie et un garant si étudiant. Écoles à proximité: ISTP - Institut régional universitaire.. 600m Faculté des sciences techniques à 800m IUT Institut universitaire de technologie à 1.6km ISTP institut de formation d'enseignement supérieur par alternance à 900m Maison des élèves de l'école des mines à 1.2km École des mines à 950m ENISE École nationale d'ingénieur à 900m Ligne de bus M4 à 400m qui dessert une grande partie des écoles et ligne M6 après M4 pour atteindre facilement l'école des mines",04/12/2020
4,Appartement,Colocation,320,960,65,"14,76923077",5,3,tout équipe réaménagé dans un style chaleureux l'appartement vient d'être rénové.,SAINT-ETIENNE,"52 rue boulevard daguerre proches de leurs campus, du centre ville ainsi que des commerces et du réseaux de tramways ( à 1 min à pied). le campus jean monnet est à deux pas.",5,C,C,,840,,https://www.leboncoin.fr/colocations/1889017892.htm,"magnifique appartement tout équipe réaménagé dans un style chaleureux. composé de 3 chambres, un salon, une cuisine ouverte, une salle de bain, et de wc indépendant pour un maximum de confort. l'appartement vient d'être rénové. vous pouvez le visiter dès maintenant les soirs de semaine ou exceptionnellement certains week-ends. situé 52 rue boulevard daguerre, l'appartement est idéalement situé pour les étudiants désireux d'être proches de leurs campus, du centre ville ainsi que des commerces et du réseaux de tramways ( à 1 min à pied). le campus jean monnet est à deux pas. tout est meublé et équipé, au 2ème étage avec un ascenseur. l'appartement bénéficie d'une excellente luminosité. les pièces de vie commune comprennent : internet haut débit ,televison, lave-vaisselles , lave-linge, four, plaque induction, micro-ondes et tout le nécessaire pour vivre au mieux chaque chambre est équipée d'un lit double + chevet + dressing ... l'appartement possède également une salle de bain avec une douche à l'italienne, et pour le confort des colocataires, des wc indépendants. toutes les chrges sont incluent dans le loyé vous n'avez plus qu'à poser vos valises (internet, chauffage, copropriété, eau ...) - dépôt de garantie (1 mois de loyer) - eligible apl - 250€ de loyer + 70€ de charges soit 320€ par mois contact pour toute visite et/ou renseignement : gaspard journet 0622866945 ou gaspard.journet.thomas@gmail.com",04/12/2020
5,Appartement,Colocation,380,1140,80,"14,25",4,3,triples vitrages,SAINT-ETIENNE,"54 rue du onze novembre. Le tram au pied de l’immeuble, une grand centre commercial avec un hyper à 200 m. Le centre ville de Saint-Étienne se trouve à 10 min à pied ou à deux stations de tram. De nombreux restaurants , coiffeurs et bars.",5,D,E,,,,https://www.leboncoin.fr/colocations/1888835101.htmm,"Disponible dès le mois de Janvier 2021 , une chambre dans une belle colocation au 54 rue du onze novembre, à Saint-Étienne. L’appartement est chic dans une deco sombre et contemporaine. L’appartement mesure 80m2 et dispose de 3 chambres en tout. L’appartement est situé au 54 rue du onze novembre au premier étage avec ascenseur . Il dispose d’un emplacement idéal pour les étudiants . Le tram au pied de l’immeuble, une grand centre commercial avec un hyper à 200 m. Le centre ville de Saint-Étienne se trouve à 10 min à pied ou à deux stations de tram. De nombreux restaurants , coiffeurs et bars. La rue reste cependant très calme grâce aux triples vitrages dans l’appartement. Le loyer s’élève à 380€ charges comprises. Dans les charges on compte , l’électricité, l’eau , internet et le chauffage. L’appartement est entièrement équipé, TV avec Netflix, lave-linge sèche-linge, cuisine équipée. Votre chambre dispose de tout , lit avec couette et draps, un coin bureau , une commode et penderie. Pour plus d’info 0659740021 . Frank",04/12/2020
6,Appartement,Colocation,330,990,98,"10,10204082",4,3,Possibilité d'une cave (vélo).loué meublé et tout équipé. ,SAINT-ETIENNE,rue Désirée Claude à 3 min à pied du campus Jean Monnet,5,A,B,,780,,https://www.leboncoin.fr/colocations/1831497882.htm,"Loue appartement 98 m2 pour une colocation étudiant à St Etienne rue Désirée Claude à 3 min à pied du campus Jean Monnet . Trois chambres à partager dans le quartier de la Tréfilerie. Immeuble sécurisé avec badge à l'entrée. Possibilité d'une cave (vélo). Appartement loué meublé et tout équipé. CUISINE : Table et chaises, Four micro onde, plaque à induction, frigo combiné, lave vaisselle, lave linge, four, grille pain, cafetière, presse orange, un ensemble moulinex, table et fer à repasser, étendage à linge individuel, aspirateur, balai. Ensemble de casseroles, assiettes, bols, fourchettes, cuillères, couteau ... SALLE A MANGER : Table à manger chaises et banc. SALON : Belle piéce de 30 m2 disposant d'un grand canapé d'angle, d'une grande TV, et d'une table salon. Chaque chambre est fermée avec un verrou, elle dispose d'un lit une place, un bureau, une commode, une armoire, un panier à linge, une poubelle, une lampe de bureau. SALLE DE BAIN : baignoire, lavabo meubles de rangement. WC indépendant. L'appartement dispose de plusieurs placards. L'appartement dispose de l'accès internet FIBRE. Non fumeur, pas d'animaux. CONDITIONS : 1 : Aucun frais d'agence, de bail, d'état des lieux ( c'est moi qui m'en occupe). 2 : Dépôt de garantie : deux mois de loyers hors charges 3 : un garant/colocataire 4 : Bail non solidaire de 9 ou 12 mois. 5 : Loyer : 265 euros/chambre 6 : charges : 65 euros /chambres. Les charges comprennent : eau, chauffage, EDF, fibre, charge de copropriété.... Le paiement du loyer se fait en début de mois d'avance par virement. LES PLUS : Appartement spacieux, tranquille pour étudier, proche immédiate de la faculté et des transports. Coup de cœur assuré. Je reste à disposition pour plus de renseignement.",04/12/2020
7,Appartement,Location,510,510,32,"15,9375",2,1,,SAINT-ETIENNE,QUARTIER FACULTES TREFILERIE,5,D,E,,540,168,https://www.leboncoin.fr/locations/1883559957.htm,"Facultes - EXCLUSIVITÉ - APPARTEMENT F2 MEUBLE ENTIEREMENT RENOVE En location : venez découvrir cet appartement T2 meublé de 32 m², dans la ville de SAINT ETIENNE (42100) QUARTIER FACULTES TREFILERIE entièrement rénové. Il se compose d'une cuisine ouverte sur séjour, une chambre,une salle de bain et WC. Le chauffage et l'eau chaude sont individuels au gaz. Cet appartement est situé dans un immeuble de bon standing. Il est équipé d'un ascenseur. Pour votre véhicule, l'appartement est mis en location avec un garage. L'appartement se trouve dans le quartier de TREFILERIE. Tous les types d'établissements scolaires se trouvent à moins de 10 minutes du bien. Niveau transports en commun, plusieurs arrêts de bus et deux lignes de tramway (T1 et T3) sont présents dans le quartier. Le bien est soumis au statut de la copropriété. Loyer de 510,00 euros par mois charges comprises dont 45,00 euros par mois de provision pour charges (soumis à la régularisation annuelle). Soit avec Assurance Habitation et Assistance* ( 14.00 euros ) : 524,00 euros. Les honoraires charge locataire sont de 352,00 euros ( soit 11,00 euros/m² ) dont 96,00 euros pour état des lieux ( soit 3,00 euros/m² ). Vous pouvez consulter les barèmes d'honoraires à l'adresse suivante : ***#bareme-location *Service facultatif. Contribution annuelle ""attentats"" non comprise. Voir conditions en agence. Référence annonce : GES36751003-151 Honoraires à la charge du locataire : 352 € TTC dont 96 € pour l'état des lieux Dépôt de garantie : 930 €",04/12/2020
8,Appartement,Location,690,690,50,"13,8",2,1,entièrement rénové en 2020 (isolation murs cloisons plafonds...) ,SAINT-ETIENNE,a 50 mètre de l'arrêt de tram de la place Jean jaurès,5,,,,,,https://www.leboncoin.fr/locations/1887065633.htm,"BONJOUR, Le bien se trouve a 50 mètre de l'arrêt de tram de la place Jean jaurès Faculté en 15 mn en tram Hôpital nord : 20 mn en tram A louer T2 en hyper centre situé au 2 place Jacquard à Saint Etienne au 3ème étage sans ascenseur. L'appartement a été entièrement rénové en 2020 (isolation murs cloisons plafonds...) Entièrement équipé : Cuisine équipée plaque induction four hotte micro onde lave vaisselle machine à laver... Une chambre avec lit en 140 cm Salon avec canapé convertible lit, télé en 160 cm... Salle de bains avec grand bac à douches et toilette Vous n'avez rien à faire à part poser vos valises. Disponible à compter du 20 Décembre 2020 N'hésitez pas à m'appeler si besoin de plus de précisions Prévoir 2 mois de caution hors charge soit 1300€ de caution Pas de frais d'agence",04/12/2020
9,Appartement,Location,500,500,63,"7,936507937",3,/,,SAINT-ETIENNE,plein centre ville place fourneyron,5,B,B,,,,https://www.leboncoin.fr/locations/1889186288.htm,loue appartement F3 meuble plein centre ville place fourneyron Saint Etienne au 3 eme étage sans ascenseur chauffage individuelle au gaz appartement tres agréable tres bien situer tous commerces a proximité qui donne sur la place location 500 euros mensuel contact. téléphone .0610306609,04/12/2020
10,Appartement,Location,520,520,50,"10,4",2,1,garage à vélo,SAINT-ETIENNE,centre ville - rue pierre termier au bas du cours fauriel,4,C,,,360,,https://www.leboncoin.fr/locations/1852170636.htm,"Honoraires réduits T2 Pour visiter, candidatez gratuitement sur le site LA GESTION EN LIGNE Cliquez sur JE VEUX VISITER et indiquez la reference : 73063 Saint Étienne centre ville appartement T2 MEUBLÉ Situé rue pierre termier au bas du cours fauriel au 3 ème étages plein sud vue dégagé très lumineux. Cet appartement est composé dune entrée, dune cuisine équipé qui donne sur un balcon, dune piece à vivre avec cheminé bar et cuisine ouverte. Salle de bain avec baignoire et douche massante, wc séparé, une chambre avec placard et bureau ainsi que de nombreux rangement. Chauffage électricité, gaz et eau individuel. Belle hauteur sous plafond, charme de lancien parquet, cheminée. Copro avec garage à vélo. Adresse : 16 rue Pierre termier 42100 St Etienne Honoraires locataire : 500€ Référence annonce : ___73063 Honoraires à la charge du locataire : 500 € TTC Montant des charges : 30 € / mois",04/12/2020
11,Appartement,Location,695,695,75,"9,266666667",4,3,rénové meublé,SAINT-ETIENNE,boulevard valbenoite,4,,,,180,,https://www.leboncoin.fr/locations/1889096092.htm,"Particulier, loue T4 rénové meublé au boulevard valbenoite. Proximité tramway et Centre deux. 1er étage, lumineux. Accès sécurisé par badge. Cuisine équipée, vaisselle, four, four micro-ondes, plaque à induction, lave linge, réfrigérateur congélateur. WC indépendant Canapé 3 places convertible en lit double 3 chambres. Literie et penderie dans les chambres. Possibilité stockage meubles en cave si vous souhaitez mettre vos meubles Chauffage individuel gaz. Loyer 680euros + 15 euros de charges (= entretien chaudière+ électricité des communs) Disponible à partir du 25 décembre",04/12/2020
12,Appartement,Colocation,290,870,68,"12,79411765",5,3,meublé,CLERMONT-FERRAND,74 bis boulevard Côte Blatin,4,D,D,,360,,https://www.leboncoin.fr/colocations/1891528362.htm,"Je loue un appartement meublé en colocation avec 3 chambres. 2 sont occupées par Vincent et Samuel, tous 2 étudiants de 19 et 24 ans. La 3em chambre se libère mi décembre. Je passe l'annonce pour eux ensuite c'est eux qui organisent les visites et choisissent. Tolérance et respect sont 2 critères importants pour nous. L'appartement est situé au 74 bis boulevard Côte Blatin, proche de l'arrêt de tram Université. Il est meublé : lit double, penderie, rangements, bureau, machine à laver, frigo, plaques de cuisson, four, cafetière, micro ondes, bouilloire, ustensiles de cuisine, chaises, tables... Le loyer est de 290e et comprend également les charges de copropriété et le chauffage. Reste à vous partager l'internet, l'électricité et l'assurance habitation obligatoire soit environ une 30en d'euros au total. Pas de frais d'agence mais une caution de 290e Apl possible. N'hésitez pas à me contacter je vous mettrai en relation avec les colocataires. 0682466292",7/12/2020
13,Appartement,Colocation,430,1720,125,"13,76",5,4,Meublé rénové,CLERMONT-FERRAND,Boulevard cote blatin,4,E,F,,960,,https://www.leboncoin.fr/colocations/1889466875.htm,"Envie de vivre dans un appart design ? Vous êtes au bon endroit, c’est « The Place To Be » ! CLERMONT-FERRAND, A louer 1 chambre dans une colocation de 4 personnes dans un superbe appartement lumineux entièrement meublé et équipé de 125 m2, le tout rénové en 2020. Les 3 autres colocataires déjà en place sont jeunes, dynamiques, chaleureux et toujours avec le sourire. Cette coloc’ offre de belles surfaces dont un magnifique salon ouvert sur une grande cuisine entièrement équipée. Vous voyagerez à la mode « Auberge Espagnole » avec ses 4 chambres à thème : Paris, Londres, New-York et Reykjavík, toutes avec leur salle de douche PRIVATIVE. Les plus : de nombreux rangements, un balcon, des meubles et des équipements de « compétition » et une grande cave. L’incontournable : son emplacement. Situé Boulevard Cote Blatin (au croisement de l’Avenue Leon Blum), l’appart profite des transports en commun à ses pieds, la gare à 5 minutes, des universités Clermont-Auvergne Pôle Tertiaire, l’UFR Lettres, Langues et Sciences ou encore l’Ecole de Droit, sans oublier du centre-ville à 10 minutes à pied. Loyer de 430 € + 80 € de charges par chambre/personne, par mois. Les charges comprennent : l’électricité, le chauffage, l’eau chaude et froide, internet en fibre optique et la taxe d’ordures ménagères. Chambre disponible le 18 décembre. Davantage de photos et vidéo sur demande.",5/12/2020
14,Appartement,Colocation,375,1125,68,"16,54411765",4,3,Meublé rénové,CLERMONT-FERRAND,Proche gare et fac droit,4,,,,900,,https://www.leboncoin.fr/colocations/1891759630.htm,"Chambres privées disponible dans un appartement rénové il y a 1 an Possible de faire un bail cour pour travailleur, étudiants Erasmus, alternant stagiaires ou toute personne de passage sur Clermont-Ferrand. T4 situé à: -5mins de la gare SNCF -6mins la fac de droit et de la place de Jaude. -1er étage d'un immeuble calme, arrêt de bus juste en dessous de l’appartement. -Un intermarché à 5 mins à pied -Les chambres sont meublés. Composition : - 3 Chambres : lits 2 places (avec matelas , sommier, oreillers, couette, 2 housses de couette, 2 draps, 2 serviettes de bain )/ dressing /un bureau/ chevet de lit/ etc - Séjour : canapé / table / TV / Internet / wifi/ Netflix etc - Cuisine : Lave-vaisselle / Meubles de rangement haut et bas avec plan de travail / Four / Plaques à gaz / Hotte / Frigo /Micro-onde/Cafetiere à dosette et soluble /casseroles et ustensiles /etc Autres: Vaisselle/ lave-linge, fer à repasser, ballai... - Salle de bain : baignoire, meuble avec miroir - WC indépendant -Place de parking gratuit en dessous de l' appartement. Recherche homme ou femme. Tarif: Prix : 375 Euro(s) de loyer + 75 Euro(s) de charges (wifi, électricité, eau chaude et froide, gaz, Netflix, services de nettoyage 1 fois toute les 2 semaines ) Caution de 650 Euro(s) Avoir un garant ou être inscrit au LocaPass qui se porte garant pour vous / assurance à prévoir. Disponible à partir du 24 Décembre 2020. N'hésitez pas à me contacter pour plus d'information ou plus de photos. 0635134252 ou 0753279776",8/12/2020
15,Appartement,Colocation,360,1080,52,"20,76923077",4,3,Meublé rénové,CLERMONT-FERRAND,15 min facs,4,,,,900,,https://www.leboncoin.fr/colocations/1891847440.htm,"Chambres privées disponible dans un appartement à peine rénové. La chambre en colocation peut être loué en location longue durée 1 an et plus. Nous offrons aussi la possibilité d'effectuer une location courte durée d’1, 2,3 mois etc.. , pour travailleurs, étudiants Erasmus, alternants,stagiaires ou toute personne de passage sur Clermont-Ferrand. T3 situé à: -9 minutes à pieds de la gare SNCF -15 minutes à pieds de la fac de droit et de la place de Jaude. -RDC surélevé d'un immeuble calme, arrêt de bus à côté -Un intermarché à 7 mins à pied -Les chambres sont meublés. Composition : - 3 Chambres contenant chacune : un lit 2 places (avec matela , sommier, oreillers, couette, 2 housses de couette, 2 draps )/ dressing /un bureau/ chevet de lit/ TV / Internet / wifi/ Netflix etc - Cuisine : Espace pour repas avec 3 chaises hautes/ Lave-vaisselle / Meubles de rangement haut et bas avec plan de travail / Four / Plaques à gaz / Frigo /Micro-onde/Cafetiere à dosette et soluble /casseroles et ustensiles /etc Autres: Vaisselle/ lave-linge /fer à repasser, ballai... - Salle de bain : douche italienne, meuble avec miroir /WC inclus -Place de parking gratuit en dessous de l' appartement. Recherche homme ou femme. Tarif: Prix : 360 Euro(s) de loyer + 75 Euro(s) de charges (wifi, électricité, eau chaude et froide, gaz, Netflix, services de nettoyage 2 fois par mois ) Caution de 435Euro(s) Avoir un garant ou être inscrit au LocaPass qui se porte garant pour vous / assurance à prévoir. Disponible dès le 15 Décembre 2020 N'hésitez pas à me contacter pour plus d'information ou plus de photos. 0753279776 ou 0635134252",8/12/2020
16,Appartement,Colocation,297,891,95,"9,378947368",4,3,,CLERMONT-FERRAND,"Gare, facs, tram",4,,,,624,,https://www.leboncoin.fr/colocations/1891482544.htm,"Notre colocataire Chloé s’en va vers de nouveaux horizons. Notre appartement, un grand T4 traversant avec des grandes pièces très lumineuses, style osmanien et refait récemment, cherche donc un nouvel occupant. Situé proche de la gare et des facs, accessible en bus et tram à 10 min à pied. Composé de 3 chambres, une grande salle de bain (avec un magnifique sol effet gazon !) et toilettes séparées, une cuisine, un salon et de nombreux rangements. L’heureux(se) élu(e) aura la chance d’occuper une magnifique chambre de 16 m 2 très calme avec vue sur cour, non meublée (donc totalement personnalisable). On recherche un(e) coloc entre 18 et 25 ans jeune actif ou étudiant. Si possible propre, respectueux et prêt à passer des moments de joie et de bonne humeur avec deux colocataires de rêve : Anthony (24 ans, jeune actif) et Millie (19 ans, étudiante en LEA). Ce qu’on aime : écouter tout style de musique, tout travail manuel (couture, dessin…), les jeux de société, les soirées (pizza, crêpe et potes) et la bière bien fraîche ! De plus, tu auras l’honneur de faire connaissance avec Pan-pan, lapin/mascotte de la Coloc Fleurie ! Loyer de 297€ + environ 52€ de charges (gaz, électricité, internet, assurance habitation). Pour en savoir plus, tu peux nous contacter au 0750838527 (Millie) ou au 0785507100 (Antho).",7/12/2020
17,Appartement,Colocation,390,1170,69,"16,95652174",4,3,,CLERMONT-FERRAND,15min centre ville,4,,,,720,,https://www.leboncoin.fr/colocations/1891084546.htm,"Venez partager et échanger dans cette chaleureuse colocation de 3 chambres, situé dans un quartier résidentiel, proche des transports et des commerces. Parfait pour un étudiant ou un jeune actif sérieux. L’APPARTEMENT L’appartement de 69m², refait à neuf et meublé grand confort, se compose : - D’un salon lumineux avec une déco coup-de-cœur pour passer des moments conviviaux. - D’une cuisine toute équipée ouverte sur le salon pour cuisiner sans être isolé de ses convives. - De 3 chambres (10 à 11,5 m²) privatives avec verrou et chaleureuses, pour se reposer et être au calme. - D’une grande salle de bain ventilée pour démarrer une journée parfaitement apprêté. Les toilettes sont séparées. Tout a été soigné et conçu pour se sentir comme à la maison et partager de bons moments de convivialité. L’ENVIRONNEMENT Le bien est situé au 3ème étage d’un immeuble sécurisé d’un quartier résidentiel. Proche de toutes commodités (transports et commerces), il permet de joindre le Centre-Ville en moins de 15 minutes à pied MODALITES Le loyer est de 390€HT + 60€ de charges (chauffage, eau chaude, eau froide, ordures ménagères, ménage des communs, électricité, internet et Netflix) Bail individuel, sans caution solidaire exigée ; des garants vous seront demandés. Vous êtes étudiants ou jeunes actifs, cet appartement est pour vous ! N'attendez plus, contactez-moi en premier par messagerie LBC. Personnes non sérieuses ou agences, s'abstenir SVP.",7/12/2020
18,Appartement,Colocation,480,1440,81,"17,77777778",4,3,,CLERMONT-FERRAND,proche facs,4,D,D,,,,https://www.leboncoin.fr/colocations/1890878484.htm,"Colocation féminine 3 Chambres à deux pas des facs. 480 euros par chambre tout compris photos bientôt disponible. Chambres disponible début mars. Merci d’indiquer vos coordonnés et un garant obligatoire. Court séjour possible. Internet et Netflix offert. Hello, we will be renting 3 rooms at 2 min from universities available from March. The rooms will be only for ladies. 480 euros everything included. Internet & Netflix will be included. Short period possible.Thanks to send me your contact I will request that one person which could pay for you in case of any issues.",6/12/2020
