Référence,Type de bien,Location / Colocation,Loyer location €/mois avec charges,Loyer colocation €/mois,Surface totale m²,€/m²,Nb pièces,Nb chambres,Autres,Commune,Détail Localisation,Note localisation,Etiquette NRJ,Etiquette GES,Coût copro /an,Coût charge /chambre (si coloc) /an,Autres coûts /an,Lien,Description entière annonce,Date publication annonce
19,Appartement,Colocation,389,1167,61,"19,13114754",4,3,,CLERMONT-FERRAND,hypercentre,5,C,B,,900,,https://www.leboncoin.fr/colocations/1890484366.htm,"Bonjour,

Je loue une chambre dans ce bel appartement traversant et lumineux en colocation, dont les 2 autres sont déjà occupées par Théo, 20 ans, étudiant en langues étrangères, et Alec, 22 ans, faisant des études d’ingénieur.

F4 de 61 m2, refait à neuf mi-2020 entièrement meublé et équipé, rénovation de qualité. 

La chambre sera disponible le 29/12. 4ème étage sans vis-à-vis, sans ascenseur.

Idéalement placé : 18 rue Sainte-Claire, hyper-centre, proche toutes commodités (supérettes, boulangerie, bars, cafés, restaurants, poste, banques…). Tram ligne A arrêt Gaillard à côté. A 7 min à pied de place de Jaude/plateau central, 12 min de l’ESC Clermont. Université Clermont Auvergne et UFR Lettres, Culture et Sciences Humaines, gare SNCF, CHU Estaing / fac dentaire, sites Michelin Carmes/Cataroux vite joignables en bus/tram. Autoroute proche.

A l’entrée, un large couloir s’ouvre à gauche sur la salle de bain, à droite sur un espace salle TV/Salon cosy. Accueillant canapé et 2 poufs, table basse pour des moments de détente, de discussions ou pour profiter d’une série sur Netflix. TV écran plat 50 pouces 4K UHD + Google Chromecast pour diffuser n’importe quel contenu depuis votre smartphone. Etagère de rangement. 

La salle de bain profite d’une douche sur-mesure, WC, meuble-vasque avec 2 tiroirs de rangement, miroir éclairé, porte-serviette.

Au fond à droite de l’appartement, la chambre à louer est la chambre « verte » de 13 m2 (Chbr2 sur le plan), très fonctionnelle et lumineuse avec magnifique vue sur le Puy-de-Dôme. Décoration scandinave raffinée. Lit 140x190cm avec un confortable matelas de 22 cm à mémoire de forme, table de chevet et lampe, bureau et caisson de rangement+poubelle, chaise, lampe de bureau, ventilateur, étagère, généreux dressing avec penderie, cintres. Rideaux et volets. Tout le linge de lit et de toilette est fourni en double.

Après l’entrée, à votre gauche la cuisine ouverte et son bar convivial s’ouvre à vous, électroménager de qualité et neuf (grand réfrigérateur-congélateur avec distributeur d’eau filtrée, lave-sèche-linge, lave-vaisselle, four, micro-ondes, rangements haut et bas, table extensible de 120-180cmx75 cm, 4 chaises. Tous les accessoires sont inclus, de la cafetière au presse-agrume, bouilloire, grille-pain, accessoires et ustensiles de cuisson, vaisselle en grande quantité pour cuisiner autant que l’envie vous prendra !

En dépassant la cuisine, vous parvenez dans un dégagement desservant les 2 autres chambres. Un cagibi avec le nécessaire de nettoyage (aspirateur, étendoir à linge, fer et table à repasser…).

Il n'y a plus qu'à poser vos valises ! 

Une grande cave peut servir de garage vélo et de stockage.

Vous avez entre 20 et 35 ans ? Vous êtes un(e) jeune actif(ve) ? Ou bien étudiant(e) 2 ou 3ème cycle universitaire ? Vous aimez la convivialité dans le respect des autres ? Cette chambre est faite pour vous !

Loyer : 

389 €+75 € de charges (chauffage, entretien chaudière, électricité, eau froide et chaude, taxe ordures ménagères, charges de copropriété, internet, abonnement Netflix HD. Seules l’assurance habitation et la taxe d’habitation restent à votre charge. Loyer total charges incluses 464 euros.

Stationnement 0,50€/jour avec la carte résident gratuite.

Bail individuel. Caution 2 mois de loyers HC. Maxi 1 occupant(e) (pas de couples).

ELIGIBLE APL. Garant demandé (CAUTION)

Merci de vous présenter par mail: coordonnées, précisez si étudiant ou salarié, passions.

Visite vidéo possible.
Appartement disponible le 29/12. A bientôt",6/12
20,Appartement,Colocation,375,1125,93,"12,09677419",4,3,,CLERMONT-FERRAND,Un peu excentré,3,,,,,,https://www.leboncoin.fr/colocations/1890459304.htm,"Une chambre se libère au 07 décembre 2020 et l'autre fin décembre. Vous souhaitez vivre en colocation ? Vous êtes en fin d'études/jeune active ? Vous êtes responsable, respectueuse, ordonnée et sociable ? Alors cet appartement peut vous intéresser ! Jade, jeune active sera ravie de vous accueillir dans l'appartement. Appartement F4 de 93m2. Adresse exacte : 86 boulevard Lavoisier, Clermont-Ferrand Au 2ème étage d'une petite copropriété possédant un jardinet. Situé à 10min à pieds du centre-ville; les transports en commun et les commerces sont à proximité. Appartement meublé : - 3 chambres - Salon avec télé - Cuisine équipée - SDB et toilettes séparés - Placard de rangement Loyer = 375€ Toutes Charges Comprises (eau, gaz, électricité, internet...) N'hésitez pas à me contacter par mail/SMS/téléphone pour davantage d'informations ou pour visiter ! :)",6/12/2020
21,Appartement,Colocation,415,1245,65,"19,15384615",4,3,,CLERMONT-FERRAND,Proche facs droit,4,D,D,,480,,https://www.leboncoin.fr/colocations/1888899699.htm,"Colocation de 3 chambres dans appartement refais à neuf dans le secteur la Pradelle/ Oradou. 2 personnes personnes déjà présentes dans le logement. L'appartement fait 65 m2 et est situé au 2 eme étage. Situation : 10 min à pied de la gare 15 min à pied des universités de lettre et droit 15 min à pied de l'école ECS Business school 15 min à pied du jardin lecoq Le logement est équipé de : - grand séjour salle à manger avec Smart TV - wifi internet -cuisine moderne : • plaques à induction, • hotte aspiration, • grand réfrigérateur avec congélateur, • four, • machine à café • lave-vaisselle et lave-linge • vaisselle et ustensiles de cuisine Les chambres sont équipées de : - Un lit 140*190 - Un bureau et une chaise - Un placard pour ranger toutes vos affaires L’appartement est fonctionnel, très pratique, et a tout le nécessaire. Vous n'avez plus qu'à poser vos valises dans la chambre disponible à partir du 15 décembre Le loyer est de 375 Euros HC Prévoir 40 euros de charges ( électricité, gaz )",3/12/2020
22,Appartement,Colocation,273,819,172,"4,761627907",6,3,,GRENOBLE,Gare,5,,,,,,https://www.leboncoin.fr/colocations/1884994948.htm,"Bonjour Bonjour! Souhaitant partir à l'aventure malgré le covid, je m'en dois donc de laisser cette super coloc. L'appartement est disponible dès à présent! Petit tour d'horizon: il restera Antoine, 26 ans, qui travaille dans un cabinet d'architecte. Et Alex, 28 ans, en cinquième année de médecine. Les deux gaillards sont franchement super sympas, et j'aimerai bien leur trouver un(e) coloc qui restera un bon moment, qui aime jouer à Mario Kart, et qui saura apprécier les discussions pleines de bonne humeur! Concernant l'appartement, il est grand, bien agencé, possède une des meilleure baignoire que tu aura l'occasion d'utiliser. La cuisine est équipée d'un frigo et d'une super gazinière pour cuisiner tes tartes ou pizza surgelées. Dans le salon, il y a un projecteur pour les soirées films ou wii. Et surtout il y a une terrasse avec de la verdure! Situé à deux pas de l'arrêt Saint Bruno, quatre pas de la gare et un pas et demi du marché de l'estacade, on a donc un appartement bien situé, qui reste toutefois calme au niveau du voisinage. La chambre est la plus petite de l'appartement, et contrairement à la photo, ne possède qu'un lit franchement confortable. Je peux toutefois voir pour te laisser une de mes étagère si tu es en galère :) Au niveau pratique, l'appartement est en caution solidaire et est géré par une agence. Il faut donc rajouter 300 euros de frais d'agence. (le classique, mais ça va encore) Il n'y a pas de charges prélevées chaque mois, mais on tourne sur du 30 euros par mois en considérant que tu passes deux heures sous l'eau chaude chaque jour. Voilà, n'hésite pas à m'envoyer un sms ou un message sur le site (évite de m'appeler, je travaille donc je ne pourrais pas répondre) pour plus de renseignements et voir pour caler une visite en face à face ou en visio ;) PS: par contre nous ne pourrons pas accepter les animaux de compagnie, Alex étant allergique :(",9/12/2020
23,Appartement,Colocation,420,1260,,"14,55372582",,3,meublé,GRENOBLE,"ligne de tram C entre les arrêts ""Vallier Dr Calmette"" et ""Vallier Catane""",5,,,,960,,https://www.leboncoin.fr/colocations/1892175859.htm,"Dans une coloc à partager avec Mael et Victoria une chambre se libère ! L'appartement, situé au 8e étage est entièrement meublé et comporte une pièce commune avec cuisine entièrement équipée (plaques vitrocéramiques, four, réfrigérateur et congélateur, lave vaisselle) ouverte sur salon. Il y a également une grande véranda avec vue sur la Chartreuse et Belledonne. La chambre est meublée avec un lit double, couette et oreillers, un bureau et chaise de bureau, un placard de rangement avec espaces penderie et étagères, une table et lampe de chevet. Machine à laver également prévue dans l'appartement. L'appartement est situé sur le boulevard Joseph Vallier sur la ligne de tram C entre les arrêts ""Vallier Dr Calmette"" et ""Vallier Catane"", qui va de Fontaine jusqu'au Campus Universitaire de Saint Martin d'Hères. C5 Express également à quelques pas de l'immeuble (qui vous emmènera à la gare en 7 min) Bail individuel, pas de caution solidaire, chacun est indépendant 1 mois de préavis. Loyer : 420€ + 80€ de charges Inclus dans les charges : Eau chaude, électricité, chauffage, charges de copropriété, TV et internet. Eligible aux APL Si intéressé(e) pour plus d'informations ou pour visiter, me contacter directement par téléphone au 06 63 95 46 20 Ou retrouvez-moi sur lacolocagrenoble.wordpress .com",9/12/2020
24,Maison,Colocation,350,1050,86,"12,20930233",4,3,,GRENOBLE,l’Estacade,5,,,,,,https://www.leboncoin.fr/colocations/1892135817.htm,"Salut, Une chambre s’est libérée dans notre coloc de trois à l’Estacade. Nous sommes donc deux à rester : Sofian, 32 ans, graphiste (en télétravail) et Claire, 30 ans, instit’. L’appartement est situé dans une maison de ville qui donne sur l’Estacade (marché tous les matins sauf le lundi) juste à côté de l’arrêt de tram Condorcet (tram E). La maison est séparée en deux appartements, deux colocs. On s’est pas mal rapprochés de la coloc du bas pendant le dernier confinement, on est souvent les uns chez les autres et même si c’est plutôt calme la semaine, on profite bien de nos soirées les weekends :) Pour les courses on les fait séparément, on essaie d’alterner pour les produits qu’on partage. Côté ménage et rangement, on n’est pas maniaque mais on essaie que ce ne soit pas trop le bordel non plus. L’organisation peut bien entendu évoluer avec l’arrivée d’un(e) nouveau(elle) coloc ;) Etant tous les deux fumeurs, nous avons décidé de fumer à l’intérieur en aérant régulièrement. L’appartement fait environ 120 m² au sol et 86 m² loi Carrez. Il est sur deux niveaux : - Au premier : hall d’entrée avec placard, salle de douche, WC séparés, cuisine équipée (four, plaques de cuissons au gaz, frigo-congélateur…) ouverte sur un grand salon avec cheminée (sera ramonée le 21 décembre), une chambre. - Au deuxième : mezzanine qui sert de coin bureau/espace tv, 2 chambres (dont celle qui se libère, cf photo), salle de bain et WC séparés. La chambre qui se libère est donc sous les toits, elle fait une dizaine de m² au sol et dispose d’un petit placard intégré. Le propriétaire a prévu de réaliser des travaux d’isolation du toit par l’extérieur au mois de janvier et s’est également engagé à refaire la cuisine. Pour ce qui est du prix du loyer, il est de 1 105€, à nous de voir comment on se le répartit, sachant que les chambres sont inégales en termes de superficie et de confort (la tienne sera la moins chère). Voilà, voilà, la chambre est déjà libre (et sera nettoyée à ton arrivée ^^) si tu es intéressé(e) n’hésite pas à nous envoyez un message, nous passer un coup de fil et/ou à venir nous rencontrer autour d’un verre ou d’autre chose :) Claire : 06 04 50 51 29 Sofian : 07 69 56 63 28",9/12/2020
25,Appartement,Colocation,300,900,60,15,4,3,"équipé, cave a velo, parking",GRENOBLE,rue Hypolite Muler,4,A,B,,,,https://www.leboncoin.fr/colocations/1892090182.htm,"Colocation une chambre vient de se libérer ( coloc de 3) ilya un étudiant et une étudiante qui sont déjà dans l’appartement... Tout équipé lave linges sèche linges... ainsi que la chambre... garage à vélos commun, cave personnel, parking privé sécurisé ( gratuit) très jolie parc à côté ....... peut se louer pour 2 mois ...300euros charges de copropriétés incluses",9/12/2020
26,Appartement,Colocation,399,2394,200,"11,97",12,6,equipé,GRENOBLE,fontaine centre,3,,,,,,https://www.leboncoin.fr/colocations/1886688481.htm,"Très grand Appartement entièrement neuf situé en centre de Fontaine dans un quartier résidentiel a 10min de Grenoble et du CEA en vélo, tous proche de la digue. (Rue Jean Pain 38600 Fontaine) Tram et transport en commun tous proche. Place de parking devant l'immeuble. Toute commodité dans le quartier. Avec une superficie de 200m2 entièrement neuve comprenant 6 chambres de 10/12M2 fermé par clé personnel avec lit simple, bureau et dressing, 3 salles de bains (séparer entre fille et garçon), 3 toilettes, un grand séjour avec deux canapés et bibliothèque et une cuisine indépendante tous équipés avec une grande table a manger, buanderie et casier individuel et une cour. Vous pourrez avoir l'indépendance qu'il vous faut. Place pour vélo et voiture garé en sécurité dans la cour. Entièrement meublé et aménagé vous n'aurez plus qu'à poser vos habits. 399€ de loyer mensuel tous compris la chambre. Pas de charge en plus et même une dame de maison chaque semaine pour le nettoyage de l'appartement (3H par semaine pour sol, wc, salle d'eau, aspirateur) Taxe d'habitation, Electricité, Eau, internet en wifi compris dans le loyer. Aménagement : cuisine entièrement équipée avec vaisselle, machine a café expresso, machine a laver, sèche linge, tous le linge de maison, tv, internet. Grand Frigo et congélateur, dressing, bureau, lit, luminaire. Disponible a partir du 1 Decembre 2020. IMPORTANT : Location minimum de 6 mois. Les fêtes ne sont pas acceptés et il est interdit d'inviter un amis pour dormir. Une caution de un mois sera demandé. Paiement par virement. Pour chaque dossier sera demandé une caution et un cautionnaire garant. Les dossiers comprenant des aides CAF (APL) son accepté (remplie par le demandeur)",9/12/2020
27,Appartement,Colocation,400,1200,76,"15,78947368",4,3,Meublé rénové,GRENOBLE,rue claude kogan,2,E,E,,,,https://www.leboncoin.fr/colocations/1892043220.htm,"Propose 3 chambres dans une colocation de 80 m carrés refait , situé rue claude kogan à grenoble , proche arret bus et tram, parking gratuit au pied de la residence, arrivée en voiture facile par la rocade sud. Colocation entierrement meublée. Louée 400 euros la chambre toute chargese comprises ( eau , electricité, internet ) Proche ecole architecte",8/12/2020
28,Appartement,Colocation,400,1600,85,"18,82352941",5,4,"refait à neuf equipé, garage à velo et cave",GRENOBLE,15 Avenue de Washington GRENOBLE,3,,,,,,https://www.leboncoin.fr/colocations/1892032962.htm,"15 Avenue de Washington GRENOBLE Petite rue calme sans circulation, stationnement gratuit. Au 3eme étage sans ascenseur. 3 chambres sur 4 de disponibles TRAM C au bout de la rue, proche caserne de Bonne. Belles prestations refait à neuf, très lumineux avec parking privé possible. Cette colocation calme et confortable entièrement équipée, s'adresse aux jeunes actifs et étudiants. LOYER 350 eur + 50 eur soit 400 euros TOUT COMPRIS : - ⚡ Électricité - 💧 Eau - ♨️ Chauffage - 🌐 Internet fibre - 📺 TV L'APPARTEMENT : - Garage à vélos et cave à disposition LES EQUIPEMENTS : - 📋 Lave-linge / Séche-linge / Cafetière et Théière / Frigo / Plaque induction / Micro-ondes grill / Fer à repasser / Aspirateur / Balai / Poele... SALON avec balcon Table et chaises, Télé, canapé, Box fibre... CHAMBRE 11 à 12m2: Avec couette neuve, oreillers neufs fournis, matelas neuf haute densité, parrure drap neuve. EMPLACEMENT : - ℹ️ Situé à Grenoble limite Saint Martin d' hères - 🛒 Superette a proximité, marché. - 🛍️ Centre ville rapide avec la ligne 12 - 📚 Proche des des universités et campus de Saint Martin d'Hères DEPLACEMENTS : - 🅿️ Parking privé possible - 🚊 Tram C arret foch ferrié - 🚌 Bus : a proximité ligne C5 chrono pour le Campus universitaire ou Ligne 12 pour le centre ville. - 🚴 Vélo : garage vélo ou cave Pas de frais d'agence. Bail individuel (sans clause de solidarité). Appartement éligible aux aides au logement ALS/APL. 2 mois de loyer de caution (hors charges). 1 mois de préavis de départ Les locataires actuels sont non fumeurs, les animaux ne sont pas acceptés, interdiction de fumer dans l'appartement. Merci m'envoyer une description de votre profil (salarié, étudiant, garants ou non, etc.) ainsi que les motivations qui vous amènent à vivre en colocation à Grenoble. Possible visite virtuelle sur WHATTSAPP Cordialement",8/12/2020
29,Appartement,Colocation,390,1560,82,"19,02439024",5,4,cuisine tout équipée garage à vélo + place de parking,GRENOBLE,Capuche alliée,2,,,,,,https://www.leboncoin.fr/colocations/1892027948.htm,Colocation de 82 m2 situé rue Marquian au 7ième étage (vue imprenable sur les montagnes) 2 salles de bains / machine à laver / cuisine tout équipée Garage à vélo + place de parking Internet fibre compris dans les charges 3 chambres sur 4 dispo,8/12/2020
30,Appartement,Colocation,395,1185,98,"12,09183673",5,3,,GRENOBLE,"quai Perrière, quartier Saint Laurent",5,,,,540,,https://www.leboncoin.fr/colocations/1879126580.htm,"A GRENOBLE, dans un grand appartement atypique actuellement loué en colocation, l'un des 3 locataires ayant donné un préavis de départ, nous recherchons un ou une remplaçant ( e ) . Immeuble bien situé sur le quai Perrière, quartier Saint Laurent, face à la passerelle piétonne donnant accès directement au centre ville. LOYER : 1142 Euros + Charges 45 Euros soit 1187 Euros par mois ( 395 Euros par locataire )",8/12/2020
31,Appartement,Colocation,495,1485,88,"16,875",4,3,"loggia, balcons copropriété sécurisée et fermée.",GRENOBLE,2 Boulevard Joseph Vallier,5,E,E,,,,https://www.leboncoin.fr/colocations/1864654119.htm,"APPARTEMENT ENTIEREMENT MEUBLE A PARTAGER , 4 pièces 3 chambres 88 m² LIBRE idéal pour jeune actif/active ou étudiant/e. EN COLOCATION 2 BOULEVARD JOSEPH VALLIER GRENOBLE L' appartement est situé au 2 Boulevard Joseph Vallier au 2 étage entièrement meuble et refait à neuf est composé d'un hall d'entrée , d'un séjour , de trois chambres d'une cuisine entièrement équipée , d'une belle salle de bain , de toilette séparées, d'une grande loggia et de balcons . Copropriété sécurisée et fermée. Idéalement situé à 5 minutes du centre ville de Grenoble 15minutes du campus 10 minutes à pied de GEM , à proximité de nombreux commerces, des écoles( GEM, COMPUS ) clinique mutualiste , des transports en communs Tram C ET E Chauffage individuel GAZ Loyer 495 €/mois par chambre (Electricité et eau non comprise) Dépôt de garantie :900.00 €",8/12/2020
32,Appartement,Colocation,460,1380,150,"9,2",5,3,,GRENOBLE,notre dame,5,,,,,,https://www.leboncoin.fr/colocations/1886957692.htm,"Nous sommes deux étudiantes (en sociologie et à Sciences Po) à la recherche d'un.e troisième colocataire pour mi janvier. L'appartement sera libre à partir du 21 janvier, il est très grand et était loué par des amis à nous donc pour les visites cela peut être assez facile à mettre en place! Ma colocataire est plutôt fêtarde et moi plutôt calme mais le bruit ne me dérange pas. Contactez moi sur cette adresse mail si la colocation peut vous intéresser: axelle.barthelemy@etu-iepg.fr",8/12/2020
33,Appartement,Colocation,305,610,67,"9,104477612",3,2,"Meublé, cave, loggia",SAINT-ETIENNE,"43 bis rue Montesquieu Il se trouve au niveau du Cours Fauriel, proche des écoles (art/sports) et à 20min (à pied) du centre-ville. - Il est facile de sortir de Saint-Etienne, car il se situe à 2 min de la voie rapide. - Arrêt de bus devant le bâtiment, pas de problème de stationnement dans la rue (ou possibilité d’avoir un parking privé (30€/mois).",4,C,C,,360,,https://www.leboncoin.fr/colocations/1893454245.htm,"Disponible au 1er janvier 2021 Idéal pour colocation. Eligible au APL et CAF Lieu : 43 bis rue Montesquieu, 42100 Saint Etienne Bâtiment propre et agréable, bien entretenu, le logement se situe au 4ème étage (sans ascenseur). Appartement idéal pour une famille / jeune couple ou collocation. Quartier très clame ! Caractéristiques : - Cuisine ouverte sur le salon, équipée d’un réfrigérateur neuf, gazinière (3 gaz + 1elec), machine à laver. Un plan de travail avec beaucoup de rangements. - Séjour (salle à manger + salon) de 27m² très lumineux et agréable. - 1 chambre de 13m² avec un dressing. - 1 chambre de 10m² / ou bureau. - Salle de bain et WC. - Loggia de 2m² - Cave de 8m² Chauffage gaz individuel Les alentours : - Il se trouve au niveau du Cours Fauriel, proche des écoles (art/sports) et à 20min (à pied) du centre-ville. - Il est facile de sortir de Saint-Etienne, car il se situe à 2 min de la voie rapide. - Arrêt de bus devant le bâtiment, pas de problème de stationnement dans la rue (ou possibilité d’avoir un parking privé (30€/mois). La location : - Logement à 305€ par locataire !! (275€ + 30 € de charges copropriété), MEUBLE Caution équivalente à un loyer : 610€ Si vous êtes intéressés, n’hésitez pas à me contacter pour plus d’informations. Merci de me contacter par mail de préférence. Au plaisir.",11/12/2020
34,Appartement,Colocation,345,1380,74,"18,64864865",5,4,"Refait à neuf en 2017, entièrement équipé",SAINT-ETIENNE,Proche facultés,4,,,,960,,https://www.leboncoin.fr/colocations/1893325465.htm,"Stéphanoises ! Stéphanois ! Rejoignez dès à présent cette colocation 4 chambres, refaite à neuve en 2017, entièrement équipée. Chambre tout confort avec lit simple et verrou individuel. Toutes charges incluses (eau, entretien des communs, chauffage, électricité, internet) : pas d'abonnement à prévoir. 4ième étage avec ascenseur et porte d'accès à l’immeuble sécurisée. Excellente luminosité. Balcon dans la pièce de vie. Cuisine toute équipée (lave-vaisselle notamment). Deux chambres de 12m2 et 10m2 (+ balcon privatif) sont équipées d'une salle de bains privative. Elles sont louées 290 euros chacune + 80 euros de charge. Les deux autres chambres de 9 m2 sont louées chacune 245 euros + 80 euros de charge. Frais de dossier (visite, validation de candidature, état des lieux entrée et sortie) : 120 euros TTC (réalisé par un professionnel) Dépôt de garantie : 1 mois de loyer + garant nécessaire. Bail meublé individuel sans clause de solidarité. Logement éligible à l'aide au logement. Visite virtuelle sur demande. Echange en anglais possible. Contact pour visite et renseignements : Valérie (valerie@ruedesvictoiresau 07 751 042 90 ou Thomas au 06 175 705 77 (bien laisser un message vocal ou sms avec vos coordonnées complètes si pas de réponse).",11/12/2020
35,Appartement,Colocation,330,660,40,"16,5",3,2,NEUF et LUMINEUX - idéal étudiants et jeunes travailleurs - 1 salle de bains/douche privative par chambre - parking et internet gratuit,SAINT-ETIENNE,idéalement situé entre le Cours Fauriel et Centre 2,4,,,,,,https://www.leboncoin.fr/colocations/1872256326.htm,"T3 MEUBLE - NEUF et LUMINEUX - idéal étudiants et jeunes travailleurs - 1 cuisine ouverte sur pièce commune, entièrement équipée, y compris vaisselle et lave linge - 2 chambres meublées literie confortable + 1 salle de bains/douche privative par chambre - Appartement phonique et thermique - Volets électriques parking et internet gratuit - Logement dans bâtiment privée, de 2 étages, sécurisé par portier - Proche grandes écoles - idéalement situé entre le Cours Fauriel et Centre 2 - espace vert et salle de sports proche - ligne de transports à proximité - visite possible sur rendez vous : Dominique 0616263490",11/12/2020
